"HRT, also called hormone therapy (HT), is the medical replacement of the female hormones oestrogen and progesterone and sometimes testosterone.",relevant,oppose
"HRT is a treatment used to help manage menopause symptoms such as hot flushes and night sweats, when they are interfering with your life.HRT can provide relief for many of the common symptoms of menopause such as hot flushes, sweats, mood swings, irritability, insomnia, joint aches and vaginal dryness.",relevant,neutral
"Because the symptoms of menopause, such as hot flushes and vaginal dryness, are related to fluctuating oestrogen, progesterone and sometimes testosterone levels, replacing these hormones for a period of time, helps to control these symptoms.",relevant,neutral
"While there are many ways to treat hot flushes and vaginal dryness, no other treatment has been shown to be as effective as oestrogen replacement therapy.",irrelevant,neutral
Current guidelines recommend women who take HRT for menopausal symptoms take the lowest effective dose for the shortest time period to alleviate symptoms.,relevant,support
"For the treatment of symptoms, women can stay on HRT for up to five years.",relevant,neutral
If HRT is taken for between one to five years it is usually considered to be “short-term HRT”.,relevant,oppose
"For many women, symptoms of menopause usually disappear within five years and short-term HRT is all that is needed.",relevant,neutral
HRT should be reviewed regularly in consultation with your doctor.,relevant,neutral
"If it is taken for more than five years, it is 'long-term HRT'.",relevant,oppose
"After five years, the need to continue should be reviewed annually and the reason for taking HRT reassessed.",relevant,neutral
"In 10% of women menopausal symptoms may continue for longer than 10 years and some women have menopausal symptoms into their 60s, 70s and even 80s.",irrelevant,neutral
These women may require HRT for symptom control for long periods.,relevant,neutral
A discussion with your doctor about how to manage menopause symptoms long-term is important if this is happening to you.,relevant,neutral
Some women can take HRT safely for many years but this must be assessed on an individual basis and be supported with regular reviews by a doctor.,relevant,neutral
"Many studies have investigated whether HRT increases the risk of cancers, further illness and disease.",relevant,support
There have been many reports in the media about the risks of HRT.,relevant,oppose
In 2002 researchers from a large study in the United States (the Women’s Health Initiative trial or WHI) reported the risks of HRT outweighed the benefits of taking it.,relevant,oppose
This caused an 80% drop in the use of HRT in the USA and 50% of women in Australia stopped using their HRT.,relevant,neutral
The WHI study looked at women who were many years older than the average age of menopause in Australia (51 years) and the study compared these older women who had been on HRT with women who had never been on HRT.,relevant,neutral
A recent comprehensive review of evidence on HRT has found HRT is an effective and safe treatment for the relief of menopause symptoms for healthy women.,relevant,support
Most studies do not show a link between weight gain and HRT use,relevant,neutral
"In several studies women who used HRT had less weight gain than those who did not use HRT.""",relevant,neutral
"Current recommendations by world experts in menopause, including our own doctors, suggest the benefits of HRT outweigh the risks for healthy menopausal women.",relevant,support
If you choose HRT you should take the lowest effective dose for only as long as required for your symptoms and regularly review your reasons to continue (or not) with your doctor.,relevant,support
"HRT can be stopped at any time – once you've stopped treatment, any increase in breast cancer risk lessens over time and is lost within 5 years.",relevant,oppose
Jean Hailes recommends each woman discuss her decision about taking HRT with her doctor regularly and whenever there are any concerns.,relevant,neutral
The recent Lancet publication of the Million Women Study (MWS) removes any lingering doubt that there's something wrong with conventional HRT.,relevant,neutral
"Other studies found that these same synthetic HRT hormones increase one's risk of heart disease and blood clots (strokes), and do nothing to prevent Alzheimer's disease.",relevant,oppose
"A 10-year French study of HRT using a low-dose estradiol patch plus oral progesterone shows no increased risk of breast cancer, strokes or heart attacks.",relevant,support
"Hormone replacement therapy is a laudable goal, but it must be done correctly.",relevant,oppose
"HRT based on correcting hormone deficiency and restoring proper physiologic balanced tissue levels, is proposed as a more sane, successful and safe technique.",relevant,oppose
"In the short term, HRT has the benefits of improving menopausal symptoms such as hot flashes, insomnia and mood swings.",relevant,support
"In the long term, HRT provides estrogen which can help prevent osteoporosis and bone fractures, and can reduce cholesterol levels (especially LDL or ""bad"" cholesterol) and protect against atherosclerosis.",relevant,neutral
"Currently, about 10 percent of women in the United States takes HRT.",relevant,neutral
Almost two-thirds of women who start taking HRT stop taking it within a few years because of side-effects such as bleeding.,relevant,oppose
HRT also has some long-term risks.,relevant,oppose
"Taking estrogen without progestin can cause cancer of the uterus; even with progestin, HRT can increase risk of breast cancer, heart problems, gallbladder disease and stroke.",relevant,oppose
"Each woman must make an individual decision, with her doctor's help, about the risks and benefits of HRT given her own condition.",relevant,neutral
"For example, a post-menopausal woman with a family history of breast cancer may not be advised to start HRT.",relevant,oppose
"On the other hand, a women with no known risk for breast cancer, but with a high risk for osteoporosis, might well benefit from HRT.",relevant,oppose
Hormone replacement therapy (HRT) is the most effective treatment for menopause symptoms that appear when hormone levels drop after menstrual cycles stop.,relevant,support
"Additionally, estrogen plays an important role in controlling the body’s use of calcium and strengthening bones, and in raising good cholesterol levels.",irrelevant,neutral
"According to WebMD, progesterone is also important for women taking estrogen who still have a uterus to protect against cancer of the uterus lining.",irrelevant,oppose
Estrogen/progesterone therapy is often medically recommended for women who have undergone hysterectomy and no longer have a uterus.,irrelevant,neutral
Research Shows that HRT Can Cause Ovarian Cancer,relevant,oppose
"According to a February 13, 2015 BBC News Health article, research in 52 separate studies has determined that HRT increases the risk of ovarian cancer.""",relevant,oppose
"According to the article, University of Oxford research found one extra ovarian cancer case for every 1,000 women and one extra ovarian cancer death for every 1,700 women who use HRT for five years beginning around the age of 50.",relevant,oppose
"At those rates, of the approximately 1,000,000 women using HRT in the U.S., around 1,000 will develop ovarian cancer.",relevant,oppose
"Risk would be reduced for women using HRT for less than 5 years, but the risk would still be there.",relevant,neutral
"Generally speaking, the American Cancer Society states that based on well-conducted studies, many physicians have become convinced that the risks of menopausal hormone replacement therapy outweigh the benefits.",relevant,oppose
"In addition to increased risk of ovarian cancer, the Society reports that estrogen-progestin (synthetic progesterone) therapy has been determined to increase the risk of breast cancer.",relevant,oppose
Estrogen therapy alone has been shown to increase the risk of endometrial cancer as well as ovarian cancer.,relevant,oppose
A study published today in The Lancet looks at short-term use of hormone replacement therapy (HRT) and the possible increased risk of ovarian cancer.,relevant,oppose
"The findings from a meta-analysis of 52 epidemiological studies, involving a total of 21488 women with ovarian cancer, almost all from North America, Europe and Australia, suggest that taking HRT for the menopause, even for just a few years, is associated with an increased risk of developing the two most common types of ovarian cancer.",relevant,oppose
This study does not provide evidence that HRT is the cause of ovarian cancer.,relevant,oppose
"Millions of women are currently taking or are considering HRT, to treat significant menopausal symptoms that cause serious distress to their quality of life, will be confused or anxious by this information.",relevant,neutral
"HRT, like any medication or treatment, has risks and benefits.",relevant,neutral
"The very small risk that this study highlights must be put in context - in that for 1,000 women who use HRT for 5 years from around the age of 50, there will only be one extra case of ovarian cancer.",relevant,oppose
Women should consider this factor in determining whether to continue to take HRT and balance it against the proven benefits in managing their individual symptoms.,relevant,neutral
"For the majority, this will mean that they will continue with treatment.",relevant,neutral
"While ovarian cancer is a serious disease, this study does not prove causation, particularly when it is stated that the incidence of ovarian cancer decreases with time after stopping HRT.",relevant,oppose
"Additionally, the data are observational with significant risk of bias from other contributing risk factors.",relevant,neutral
It is important to emphasise that the absolute risk is extremely small.,relevant,neutral
Women who are currently taking HRT should not be concerned by this report.,relevant,neutral
"HRT is the most effective treatment for symptoms of the menopause and when HRT is individually tailored, it provides more benefits than risks for the majority of women under the age of 60, and for many beyond that age.",relevant,support
Studies on the use of HRT after the age of 50 suggest there is a small increased risk in breast cancer with the length of time it is used.,relevant,oppose
Other studies would suggest that this risk is only associated with some HRT regimens and not with all forms of HRT.,relevant,neutral
Having a risk factor does not mean that a woman will develop breast cancer and even if a risk factor is identified in a woman with breast cancer there is no way of proving that HRT was the cause.,relevant,oppose
Clinical studies have proved that HRT is effective for the relief of menopausal symptoms.,relevant,support
There is also good evidence that HRT use defers the loss of bone density.,relevant,neutral
The benefits of taking HRT for symptom relief during the menopause outweigh the risks associated with its use in most women.,relevant,support
